{
  "schema": 2,
  "semester": "2026/2027-GANJIL",
  "updatedAt": "2026-09-14T09:36:00+07:00",
  "data": {
    "class_name": "D3-3C",
    "schedule": [
      {"day":"SENIN","sessions":[
        {"time":"07.50-15.20","course_code":"25IF3126","course_name":"Best Practices Pengembangan Perangkat Lunak Industri","type":"PR","lecturer_code":"SF","lecturer":"Sofy Fitriani, S.S.T., M.Kom","room":"H506-Kelas"}
      ]},
      {"day":"SELASA","sessions":[
        {"time":"14.40-15.20","course_code":"25IF3123","course_name":"Etika Profesi","type":"TE","lecturer_code":"ID","lecturer":"Ida Suhartini, S.Kom., MMSI.","room":"D224-Kelas"}
      ]},
      {"day":"RABU","sessions":[
        {"time":"10.40-12.20","course_code":"25IF3123","course_name":"Etika Profesi","type":"PR","lecturer_code":"ID","lecturer":"Ida Suhartini, S.Kom., MMSI.","room":"H506-Kelas"}
      ]},
      {"day":"KAMIS","sessions":[
        {"time":"07.00-10.40","course_code":"25IF3128","course_name":"Proyek 5 : Studi Kelayakan Pengembangan Perangkat Lunak Aplikasi","type":"PR","lecturer_code":"JN,JO,TG","lecturer":"Jonner Hutahaean, Joe Lian Min, Trisna Gelar","room":"D107-Lab. RPL"},
        {"time":"10.40-11.30","course_code":"25IF3124","course_name":"Pengantar Pengembangan Perangkat Lunak Industri","type":"TE","lecturer_code":"LH","lecturer":"Lukmannul Hakim Firdaus, S.Kom., M.T.","room":"D223-Kelas"}
      ]},
      {"day":"JUMAT","sessions":[
        {"time":"07.00-10.40","course_code":"25IF3124","course_name":"Pengantar Pengembangan Perangkat Lunak Industri","type":"PR","lecturer_code":"JN","lecturer":"Jonner Hutahaean, BSET., M.Info.Sys.","room":"H504-Kelas"}
      ]}
    ]
  }
}
