{
  "schema": 2,
  "semester": "2026/2027-GANJIL",
  "updatedAt": "2026-09-14T09:36:00+07:00",
  "data": {
    "class_name": "D4-4B",
    "schedule": [
      {"day":"SENIN","sessions":[
        {"time":"13.50-15.20","course_code":"25TI4105","course_name":"Etika dan Aspek Legal Teknologi Informasi","type":"PR","lecturer_code":"BW","lecturer":"Bambang Wisnuadhi, S.Si., M.T.","room":"D116-Lab. PjBL-2"}
      ]},
      {"day":"RABU","sessions":[
        {"time":"07.00-10.40","course_code":"25TI4106","course_name":"Proyek 4 : Studi Kelayakan Penelitian dan Pengembangan Rekayasa Sistem Perangkat Lunak","type":"PR","lecturer_code":"AN,HA,SD","lecturer":"Ani Rahmani, Ade Hodijah, Siti Dwi Setiarini","room":"D116-Lab. PjBL-2"},
        {"time":"13.50-14.40","course_code":"25TI4105","course_name":"Etika dan Aspek Legal Teknologi Informasi","type":"TE","lecturer_code":"BW","lecturer":"Bambang Wisnuadhi, S.Si., M.T.","room":"D101-Kelas"}
      ]},
      {"day":"KAMIS","sessions":[
        {"time":"07.00-14.40","course_code":"25TI4103","course_name":"Best Practices Rekayasa Sistem Perangkat Lunak Industri","type":"PR","lecturer_code":"ZA","lecturer":"Zulkifli Arsyad, S.Kom., M.T.","room":"D108-Kelas"}
      ]},
      {"day":"JUMAT","sessions":[
        {"time":"07.00-10.40","course_code":"25TI4101","course_name":"Pengantar Rekayasa Sistem Perangkat Lunak Industri","type":"PR","lecturer_code":"TF","lecturer":"Tarekh Febriana Putra, M.Pd.","room":"D112-Kelas"},
        {"time":"14.40-15.20","course_code":"25TI4101","course_name":"Pengantar Rekayasa Sistem Perangkat Lunak Industri","type":"TE","lecturer_code":"TF","lecturer":"Tarekh Febriana Putra, M.Pd.","room":"D101-Kelas"}
      ]}
    ]
  }
}
