{
  "schema": 2,
  "semester": "2026/2027-GANJIL",
  "updatedAt": "2026-09-14T09:36:00+07:00",
  "data": {
    "class_name": "D4-4A",
    "schedule": [
      {"day":"SENIN","sessions":[
        {"time":"07.50-15.20","course_code":"25TI4103","course_name":"Best Practices Rekayasa Sistem Perangkat Lunak Industri","type":"PR","lecturer_code":"ID","lecturer":"Ida Suhartini, S.Kom., MMSI.","room":"D223-Kelas"}
      ]},
      {"day":"RABU","sessions":[
        {"time":"07.00-10.40","course_code":"25TI4106","course_name":"Proyek 4 : Studi Kelayakan Penelitian dan Pengembangan Rekayasa Sistem Perangkat Lunak","type":"PR","lecturer_code":"SN,TR,MR","lecturer":"Santi Sundari, Dr. Transmissia Semiawan, Muhammad Rizqi Sholahuddin","room":"D115-Lab. PjBL-1"}
      ]},
      {"day":"KAMIS","sessions":[
        {"time":"10.40-11.30","course_code":"25TI4105","course_name":"Etika dan Aspek Legal Teknologi Informasi","type":"TE","lecturer_code":"BW","lecturer":"Bambang Wisnuadhi, S.Si., M.T.","room":"D112-Kelas"},
        {"time":"13.50-15.20","course_code":"25TI4105","course_name":"Etika dan Aspek Legal Teknologi Informasi","type":"PR","lecturer_code":"BW","lecturer":"Bambang Wisnuadhi, S.Si., M.T.","room":"D111-Kelas"}
      ]},
      {"day":"JUMAT","sessions":[
        {"time":"10.40-11.30","course_code":"25TI4101","course_name":"Pengantar Rekayasa Sistem Perangkat Lunak Industri","type":"TE","lecturer_code":"CJ","lecturer":"Cahaya juniarti, M. Pd.","room":"H506-Kelas"},
        {"time":"13.00-16.30","course_code":"25TI4101","course_name":"Pengantar Rekayasa Sistem Perangkat Lunak Industri","type":"PR","lecturer_code":"CJ","lecturer":"Cahaya juniarti, M. Pd.","room":"H506-Kelas"}
      ]}
    ]
  }
}
